{
  "adapters": [
    "web"
  ],
  "findings": [
    {
      "adapter": "web",
      "area": "B",
      "confidence": "LOW",
      "design_risk": "고정 크기나 절대 위치가 콘텐츠·번역·viewport 변화에서 구조를 깨뜨릴 수 있다.",
      "file": "style.css",
      "finding_id": "web-b-w-b-fixed-layout-0045d15be8",
      "line": 20,
      "observed_evidence": "@media (max-width: 760px) { .shell { padding: 2rem 1.25rem; } header { align-items: start; flex-direction: column; } .steps { grid-template-columns: 1fr; } }",
      "proposed_change": "해당 고정값의 연출 목적을 확인하고 필요하면 flow, flex, grid 또는 유연한 제약으로 바꾼다.",
      "severity": "MEDIUM",
      "status": "CANDIDATE",
      "verification_predicate": "대표 viewport와 긴 콘텐츠에서 겹침·잘림·가로 스크롤이 없는지 확인한다."
    },
    {
      "adapter": "web",
      "area": "E",
      "confidence": "LOW",
      "design_risk": "직접 색상 값이 상태 체계와 대비 규칙에서 벗어날 수 있다.",
      "file": "style.css",
      "finding_id": "web-e-w-e-color-literal-6b90ece857",
      "line": 3,
      "observed_evidence": "body { margin: 0; min-height: 100vh; background: #091116; color: var(--ink); font-family: \"Noto Sans KR\", \"Malgun Gothic\", sans-serif; }",
      "proposed_change": "실제 전경·배경과 상태 역할을 확인하고 필요한 경우에만 승인된 토큰으로 연결한다.",
      "severity": "LOW",
      "status": "CANDIDATE",
      "verification_predicate": "실제 조합의 대비와 normal·hover·focus·disabled 상태 구분을 확인한다."
    }
  ],
  "scanned_files": 2,
  "scanned_root": "after",
  "schema_version": 1,
  "suppressions": []
}
